{
  "protocol_id": "v6_h2_materiality_interaction_v1",
  "version": "1",
  "state": "exploratory",
  "comparison": {
    "baseline_config": "A_technical",
    "comparison_config": "C_technical_semantic",
    "model": "RandomForest",
    "primary_protocol": "v6_technical_primary_v1"
  },
  "exposure": {
    "column": "materiality_hm_prior_20_sessions",
    "definition": "at least one high or medium materiality event in the 20 completed ticker trading sessions before the decision session",
    "same_day_events": "excluded",
    "comparator": "no high or medium materiality event in the prior 20 completed ticker trading sessions",
    "required_source_statuses": ["valid_source_event", "no_valid_news"]
  },
  "estimand": {
    "metric": "Brier improvement, where improvement is Brier(A) minus Brier(C)",
    "interaction": "mean(C-A Brier improvement | exposed) minus mean(C-A Brier improvement | comparator)",
    "positive_direction": "semantic configuration improves more under prior materiality exposure"
  },
  "inference": {
    "unit": "paired fold-local date-level interaction",
    "bootstrap": "fold_local_moving_date_block",
    "permutation": "fold_local_date_block_sign_flip",
    "bootstrap_samples": 10000,
    "permutation_samples": 10000,
    "block_dates": 20,
    "seed": 42,
    "alpha": 0.05,
    "correction_family": ["H2_materiality_interaction"]
  },
  "gates": {
    "required_folds": 3,
    "min_paired_dates": 10,
    "min_observations_per_group": 50,
    "require_non_degenerate_bootstrap": true,
    "discovery_result_state": "exploratory"
  }
}
